{
  "schemaVersion": 1,
  "task": "T8.1.5",
  "generatedAt": "2026-08-01T12:48:33.443Z",
  "mode": "fixture",
  "source": "clean:source",
  "target": "clean:target",
  "status": "clean",
  "tolerancePolicy": {
    "economicFacts": 0,
    "unexplainedFacts": 0
  },
  "summary": {
    "invariants": 14,
    "sourceFacts": 14,
    "targetFacts": 14,
    "invariantsWithDrift": 0,
    "unexplainedDiff": 0
  },
  "invariants": [
    {
      "id": "finance.payment-facts",
      "owner": "SYS-COMMERCE",
      "economic": true,
      "tolerance": 0,
      "description": "Append-only active payment facts remain identical.",
      "sourceCount": 1,
      "targetCount": 1,
      "sourceDigestSha256": "8bdb9427d753c5b8464f8a059463711084e1ae3d2198209b0576f87fef298c80",
      "targetDigestSha256": "8bdb9427d753c5b8464f8a059463711084e1ae3d2198209b0576f87fef298c80",
      "unexplainedDiff": []
    },
    {
      "id": "finance.adjustment-facts",
      "owner": "SYS-COMMERCE",
      "economic": true,
      "tolerance": 0,
      "description": "Account adjustment facts and lifecycle remain identical.",
      "sourceCount": 1,
      "targetCount": 1,
      "sourceDigestSha256": "ee4290a1d2e5b4e5f0ecb54b4d8c84afdbf18cd373c53dd02ea8c68c964f842f",
      "targetDigestSha256": "ee4290a1d2e5b4e5f0ecb54b4d8c84afdbf18cd373c53dd02ea8c68c964f842f",
      "unexplainedDiff": []
    },
    {
      "id": "finance.balance-facts",
      "owner": "SYS-COMMERCE",
      "economic": true,
      "tolerance": 0,
      "description": "Materialized student balances remain identical.",
      "sourceCount": 1,
      "targetCount": 1,
      "sourceDigestSha256": "c9c2934e1a4486ab70bcf58976ab7055d059b4a7d370e2d382050c7b3f0ff6a8",
      "targetDigestSha256": "c9c2934e1a4486ab70bcf58976ab7055d059b4a7d370e2d382050c7b3f0ff6a8",
      "unexplainedDiff": []
    },
    {
      "id": "commerce.subscription-facts",
      "owner": "SYS-COMMERCE",
      "economic": true,
      "tolerance": 0,
      "description": "Issued subscription ownership, usage, and links remain identical.",
      "sourceCount": 1,
      "targetCount": 1,
      "sourceDigestSha256": "2b259409b313c88a7844cdae8ecdfd28ecf04459dd9f99c7105ee568e22877b0",
      "targetDigestSha256": "2b259409b313c88a7844cdae8ecdfd28ecf04459dd9f99c7105ee568e22877b0",
      "unexplainedDiff": []
    },
    {
      "id": "commerce.installment-facts",
      "owner": "SYS-COMMERCE",
      "economic": true,
      "tolerance": 0,
      "description": "Issued installment schedule and lifecycle remain identical.",
      "sourceCount": 1,
      "targetCount": 1,
      "sourceDigestSha256": "02870e2f8fcc3c337b6a0da718561abfaaf0de5eeaf65c8c23429698de7b7395",
      "targetDigestSha256": "02870e2f8fcc3c337b6a0da718561abfaaf0de5eeaf65c8c23429698de7b7395",
      "unexplainedDiff": []
    },
    {
      "id": "commerce.obligation-facts",
      "owner": "SYS-COMMERCE",
      "economic": true,
      "tolerance": 0,
      "description": "Append-only subscription obligations remain identical.",
      "sourceCount": 1,
      "targetCount": 1,
      "sourceDigestSha256": "b5d255b884d225b65870fb9d7ea2effca9b8b90332c0279db3e1f050369c76f7",
      "targetDigestSha256": "b5d255b884d225b65870fb9d7ea2effca9b8b90332c0279db3e1f050369c76f7",
      "unexplainedDiff": []
    },
    {
      "id": "commerce.lifecycle-facts",
      "owner": "SYS-COMMERCE",
      "economic": false,
      "tolerance": 0,
      "description": "Subscription issue/replace/cancel history remains identical.",
      "sourceCount": 1,
      "targetCount": 1,
      "sourceDigestSha256": "f9e49ffea089ca1cb7d964b5c04daddb04fe0f90906add0141fce67f59c4f2a3",
      "targetDigestSha256": "f9e49ffea089ca1cb7d964b5c04daddb04fe0f90906add0141fce67f59c4f2a3",
      "unexplainedDiff": []
    },
    {
      "id": "commerce.lesson-charge-facts",
      "owner": "SYS-COMMERCE",
      "economic": true,
      "tolerance": 0,
      "description": "Immutable Lesson client charge facts remain identical.",
      "sourceCount": 1,
      "targetCount": 1,
      "sourceDigestSha256": "1f5ae1b6f6adf6b28d59acc64360973c5e858414768b3dfb116c607ba503a4f6",
      "targetDigestSha256": "1f5ae1b6f6adf6b28d59acc64360973c5e858414768b3dfb116c607ba503a4f6",
      "unexplainedDiff": []
    },
    {
      "id": "commerce.teacher-compensation-facts",
      "owner": "SYS-COMMERCE",
      "economic": true,
      "tolerance": 0,
      "description": "Immutable Lesson teacher compensation facts remain identical.",
      "sourceCount": 1,
      "targetCount": 1,
      "sourceDigestSha256": "7c1245bcdc6c2cb8245ac6403a3c1c3e3439e8320fc2d7e8dead304756802bbd",
      "targetDigestSha256": "7c1245bcdc6c2cb8245ac6403a3c1c3e3439e8320fc2d7e8dead304756802bbd",
      "unexplainedDiff": []
    },
    {
      "id": "commerce.reservation-facts",
      "owner": "SYS-COMMERCE",
      "economic": false,
      "tolerance": 0,
      "description": "Lesson coverage allocation and terminal state remain identical.",
      "sourceCount": 1,
      "targetCount": 1,
      "sourceDigestSha256": "e193431a27da4ee1a728fb708a886c821d895fa691522b3efdd1ebe86e4877bc",
      "targetDigestSha256": "e193431a27da4ee1a728fb708a886c821d895fa691522b3efdd1ebe86e4877bc",
      "unexplainedDiff": []
    },
    {
      "id": "schedule.lesson-facts",
      "owner": "SYS-SCHEDULE",
      "economic": false,
      "tolerance": 0,
      "description": "Lesson lifecycle, resources, and audience remain identical.",
      "sourceCount": 1,
      "targetCount": 1,
      "sourceDigestSha256": "8f02d4286b159d7e5d06f7aeadc170fe65a871a174732067762658a72e7d9b55",
      "targetDigestSha256": "8f02d4286b159d7e5d06f7aeadc170fe65a871a174732067762658a72e7d9b55",
      "unexplainedDiff": []
    },
    {
      "id": "schedule.participation-facts",
      "owner": "SYS-SCHEDULE",
      "economic": true,
      "tolerance": 0,
      "description": "Attendance and charge participation facts remain identical.",
      "sourceCount": 1,
      "targetCount": 1,
      "sourceDigestSha256": "9c82dcf3319253b49a03fb8b1dc9b13dba85bf92640c87472c666bea258a9ddc",
      "targetDigestSha256": "9c82dcf3319253b49a03fb8b1dc9b13dba85bf92640c87472c666bea258a9ddc",
      "unexplainedDiff": []
    },
    {
      "id": "workflow.task-facts",
      "owner": "SYS-WORKFLOW",
      "economic": false,
      "tolerance": 0,
      "description": "Task target, audience, lifecycle, and version inputs remain identical.",
      "sourceCount": 1,
      "targetCount": 1,
      "sourceDigestSha256": "303736f95c187241b8c129633057af2c233b5926b82ba667d59ef4346808b556",
      "targetDigestSha256": "303736f95c187241b8c129633057af2c233b5926b82ba667d59ef4346808b556",
      "unexplainedDiff": []
    },
    {
      "id": "access.role-mappings",
      "owner": "SYS-ACCESS",
      "economic": false,
      "tolerance": 0,
      "description": "Application role and CRM entity mappings remain identical.",
      "sourceCount": 1,
      "targetCount": 1,
      "sourceDigestSha256": "30391e234b2d7c4741b1181f38cf24f6ae06a63a3144cef1065606dcd84f11f0",
      "targetDigestSha256": "30391e234b2d7c4741b1181f38cf24f6ae06a63a3144cef1065606dcd84f11f0",
      "unexplainedDiff": []
    }
  ],
  "signature": {
    "algorithm": "Ed25519",
    "contentSha256": "74ea5aff74c990f56962289566ddc8eced4d08ee3e75fe99f14b8f87f418e339",
    "publicKeyPem": "-----BEGIN PUBLIC KEY-----\nMCowBQYDK2VwAyEAx4kBaM+ENpZ5Tmc1bBb5gXYSIF2D0RsSojjwIgbqmbk=\n-----END PUBLIC KEY-----\n",
    "valueBase64": "hA2LNaZc80oHVxVtFr42DYhYjy0FwwRVXSku8Jm+AzLVksaWmv3d2RXN2QkCtTgaVJF8I8we48L2f+KTyNKhCg==",
    "verified": true
  }
}
