{
  "schemaVersion": 1,
  "task": "T8.1.5",
  "generatedAt": "2026-08-07T04:05:17.305Z",
  "mode": "schema-compare",
  "source": "app",
  "target": "app",
  "status": "clean",
  "tolerancePolicy": {
    "economicFacts": 0,
    "unexplainedFacts": 0
  },
  "summary": {
    "invariants": 17,
    "sourceFacts": 1,
    "targetFacts": 1,
    "invariantsWithDrift": 0,
    "unexplainedDiff": 0
  },
  "invariants": [
    {
      "id": "finance.payment-facts",
      "owner": "SYS-COMMERCE",
      "economic": true,
      "tolerance": 0,
      "description": "Append-only active payment facts remain identical.",
      "sourceCount": 0,
      "targetCount": 0,
      "sourceDigestSha256": "e3b0c44298fc1c149afbf4c8996fb92427ae41e4649b934ca495991b7852b855",
      "targetDigestSha256": "e3b0c44298fc1c149afbf4c8996fb92427ae41e4649b934ca495991b7852b855",
      "unexplainedDiff": []
    },
    {
      "id": "finance.adjustment-facts",
      "owner": "SYS-COMMERCE",
      "economic": true,
      "tolerance": 0,
      "description": "Account adjustment facts and lifecycle remain identical.",
      "sourceCount": 0,
      "targetCount": 0,
      "sourceDigestSha256": "e3b0c44298fc1c149afbf4c8996fb92427ae41e4649b934ca495991b7852b855",
      "targetDigestSha256": "e3b0c44298fc1c149afbf4c8996fb92427ae41e4649b934ca495991b7852b855",
      "unexplainedDiff": []
    },
    {
      "id": "finance.balance-facts",
      "owner": "SYS-COMMERCE",
      "economic": true,
      "tolerance": 0,
      "description": "Materialized student balances remain identical.",
      "sourceCount": 0,
      "targetCount": 0,
      "sourceDigestSha256": "e3b0c44298fc1c149afbf4c8996fb92427ae41e4649b934ca495991b7852b855",
      "targetDigestSha256": "e3b0c44298fc1c149afbf4c8996fb92427ae41e4649b934ca495991b7852b855",
      "unexplainedDiff": []
    },
    {
      "id": "commerce.subscription-facts",
      "owner": "SYS-COMMERCE",
      "economic": true,
      "tolerance": 0,
      "description": "Issued subscription ownership, usage, and links remain identical.",
      "sourceCount": 0,
      "targetCount": 0,
      "sourceDigestSha256": "e3b0c44298fc1c149afbf4c8996fb92427ae41e4649b934ca495991b7852b855",
      "targetDigestSha256": "e3b0c44298fc1c149afbf4c8996fb92427ae41e4649b934ca495991b7852b855",
      "unexplainedDiff": []
    },
    {
      "id": "commerce.installment-facts",
      "owner": "SYS-COMMERCE",
      "economic": true,
      "tolerance": 0,
      "description": "Issued installment schedule and lifecycle remain identical.",
      "sourceCount": 0,
      "targetCount": 0,
      "sourceDigestSha256": "e3b0c44298fc1c149afbf4c8996fb92427ae41e4649b934ca495991b7852b855",
      "targetDigestSha256": "e3b0c44298fc1c149afbf4c8996fb92427ae41e4649b934ca495991b7852b855",
      "unexplainedDiff": []
    },
    {
      "id": "commerce.obligation-facts",
      "owner": "SYS-COMMERCE",
      "economic": true,
      "tolerance": 0,
      "description": "Append-only subscription obligations remain identical.",
      "sourceCount": 0,
      "targetCount": 0,
      "sourceDigestSha256": "e3b0c44298fc1c149afbf4c8996fb92427ae41e4649b934ca495991b7852b855",
      "targetDigestSha256": "e3b0c44298fc1c149afbf4c8996fb92427ae41e4649b934ca495991b7852b855",
      "unexplainedDiff": []
    },
    {
      "id": "commerce.lifecycle-facts",
      "owner": "SYS-COMMERCE",
      "economic": false,
      "tolerance": 0,
      "description": "Subscription issue/replace/cancel history remains identical.",
      "sourceCount": 0,
      "targetCount": 0,
      "sourceDigestSha256": "e3b0c44298fc1c149afbf4c8996fb92427ae41e4649b934ca495991b7852b855",
      "targetDigestSha256": "e3b0c44298fc1c149afbf4c8996fb92427ae41e4649b934ca495991b7852b855",
      "unexplainedDiff": []
    },
    {
      "id": "commerce.client-payment-records",
      "owner": "SYS-COMMERCE",
      "economic": true,
      "tolerance": 0,
      "description": "Three-state client payment aggregates remain identical.",
      "sourceCount": 0,
      "targetCount": 0,
      "sourceDigestSha256": "e3b0c44298fc1c149afbf4c8996fb92427ae41e4649b934ca495991b7852b855",
      "targetDigestSha256": "e3b0c44298fc1c149afbf4c8996fb92427ae41e4649b934ca495991b7852b855",
      "unexplainedDiff": []
    },
    {
      "id": "commerce.client-payment-status-events",
      "owner": "SYS-COMMERCE",
      "economic": false,
      "tolerance": 0,
      "description": "Payment status history and reasons remain identical.",
      "sourceCount": 0,
      "targetCount": 0,
      "sourceDigestSha256": "e3b0c44298fc1c149afbf4c8996fb92427ae41e4649b934ca495991b7852b855",
      "targetDigestSha256": "e3b0c44298fc1c149afbf4c8996fb92427ae41e4649b934ca495991b7852b855",
      "unexplainedDiff": []
    },
    {
      "id": "commerce.reporting-exclusions",
      "owner": "SYS-COMMERCE",
      "economic": true,
      "tolerance": 0,
      "description": "Reporting source/counterpart exclusions remain identical.",
      "sourceCount": 0,
      "targetCount": 0,
      "sourceDigestSha256": "e3b0c44298fc1c149afbf4c8996fb92427ae41e4649b934ca495991b7852b855",
      "targetDigestSha256": "e3b0c44298fc1c149afbf4c8996fb92427ae41e4649b934ca495991b7852b855",
      "unexplainedDiff": []
    },
    {
      "id": "commerce.lesson-charge-facts",
      "owner": "SYS-COMMERCE",
      "economic": true,
      "tolerance": 0,
      "description": "Immutable Lesson client charge facts remain identical.",
      "sourceCount": 0,
      "targetCount": 0,
      "sourceDigestSha256": "e3b0c44298fc1c149afbf4c8996fb92427ae41e4649b934ca495991b7852b855",
      "targetDigestSha256": "e3b0c44298fc1c149afbf4c8996fb92427ae41e4649b934ca495991b7852b855",
      "unexplainedDiff": []
    },
    {
      "id": "commerce.teacher-compensation-facts",
      "owner": "SYS-COMMERCE",
      "economic": true,
      "tolerance": 0,
      "description": "Immutable Lesson teacher compensation facts remain identical.",
      "sourceCount": 0,
      "targetCount": 0,
      "sourceDigestSha256": "e3b0c44298fc1c149afbf4c8996fb92427ae41e4649b934ca495991b7852b855",
      "targetDigestSha256": "e3b0c44298fc1c149afbf4c8996fb92427ae41e4649b934ca495991b7852b855",
      "unexplainedDiff": []
    },
    {
      "id": "commerce.reservation-facts",
      "owner": "SYS-COMMERCE",
      "economic": false,
      "tolerance": 0,
      "description": "Lesson coverage allocation and terminal state remain identical.",
      "sourceCount": 0,
      "targetCount": 0,
      "sourceDigestSha256": "e3b0c44298fc1c149afbf4c8996fb92427ae41e4649b934ca495991b7852b855",
      "targetDigestSha256": "e3b0c44298fc1c149afbf4c8996fb92427ae41e4649b934ca495991b7852b855",
      "unexplainedDiff": []
    },
    {
      "id": "schedule.lesson-facts",
      "owner": "SYS-SCHEDULE",
      "economic": false,
      "tolerance": 0,
      "description": "Lesson lifecycle, resources, and audience remain identical.",
      "sourceCount": 0,
      "targetCount": 0,
      "sourceDigestSha256": "e3b0c44298fc1c149afbf4c8996fb92427ae41e4649b934ca495991b7852b855",
      "targetDigestSha256": "e3b0c44298fc1c149afbf4c8996fb92427ae41e4649b934ca495991b7852b855",
      "unexplainedDiff": []
    },
    {
      "id": "schedule.participation-facts",
      "owner": "SYS-SCHEDULE",
      "economic": true,
      "tolerance": 0,
      "description": "Attendance and charge participation facts remain identical.",
      "sourceCount": 0,
      "targetCount": 0,
      "sourceDigestSha256": "e3b0c44298fc1c149afbf4c8996fb92427ae41e4649b934ca495991b7852b855",
      "targetDigestSha256": "e3b0c44298fc1c149afbf4c8996fb92427ae41e4649b934ca495991b7852b855",
      "unexplainedDiff": []
    },
    {
      "id": "workflow.task-facts",
      "owner": "SYS-WORKFLOW",
      "economic": false,
      "tolerance": 0,
      "description": "Task target, audience, lifecycle, and version inputs remain identical.",
      "sourceCount": 0,
      "targetCount": 0,
      "sourceDigestSha256": "e3b0c44298fc1c149afbf4c8996fb92427ae41e4649b934ca495991b7852b855",
      "targetDigestSha256": "e3b0c44298fc1c149afbf4c8996fb92427ae41e4649b934ca495991b7852b855",
      "unexplainedDiff": []
    },
    {
      "id": "access.role-mappings",
      "owner": "SYS-ACCESS",
      "economic": false,
      "tolerance": 0,
      "description": "Application role and CRM entity mappings remain identical.",
      "sourceCount": 1,
      "targetCount": 1,
      "sourceDigestSha256": "ec61677fce314a43e6095b759f7877f2292fc7753bc5801d5aa3baf4dbb90f6f",
      "targetDigestSha256": "ec61677fce314a43e6095b759f7877f2292fc7753bc5801d5aa3baf4dbb90f6f",
      "unexplainedDiff": []
    }
  ],
  "signature": {
    "algorithm": "Ed25519",
    "contentSha256": "cb27aae78909899ad135abc7d69ea7541efade3cba5cb6239be5819daa0f86d1",
    "publicKeyPem": "-----BEGIN PUBLIC KEY-----\nMCowBQYDK2VwAyEA/jpiFA20wweZiVWuBGCzUUZWJ/dupgDTnBEi5Rymwis=\n-----END PUBLIC KEY-----\n",
    "valueBase64": "NE3irFEhPVb35T+Bk/PdVSa8SggB06XP6vHBK4wTjmYwD5I1ec1oIRTmYALTyt2XPak+0HAWs4wuusOxDKpeAQ==",
    "verified": true
  }
}
